{
  "schema_version": "1.0.0",
  "bot_id": "car-forensics",
  "display_name": "car Wallet Forensics",
  "domain": "wallet-forensics",
  "version": "0.1.0",
  "lifecycle_stage": "research",
  "enabled": false,
  "managed_by_registry": false,
  "execution": {"mode": "read_only", "environment": "development"},
  "entrypoint": {"script": "car_forensics_v001.py", "module": "polymarket_bot.car_forensics"},
  "data_dir": "data/car_forensics",
  "safety": {"real_money": false, "automatic_orders": false, "withdrawals": false},
  "tags": ["wallet", "forensics", "read-only", "shadow-copy-planned"],
  "notes": "Auditoría histórica de @car concluida; Shadow Copy permanece pendiente y deshabilitado."
}
