{
  "schema_version": "1.0.0",
  "bot_id": "polyledger-sentinel",
  "display_name": "PolyLedger Sentinel",
  "domain": "ledger",
  "version": "0.1.0",
  "lifecycle_stage": "research",
  "enabled": false,
  "managed_by_registry": false,
  "execution": {"mode": "read_only", "environment": "development"},
  "entrypoint": {"script": "polyledger_sentinel_v001.py", "module": "polymarket_bot.polyledger"},
  "data_dir": "data/polyledger",
  "safety": {"real_money": false, "automatic_orders": false, "withdrawals": false},
  "tags": ["wallet", "ledger", "forensics", "read-only"],
  "notes": "Capa de evidencia para reconstrucción de carteras; candidato a núcleo compartido."
}
