{
  "schema_version": "1.0.0",
  "bot_id": "climate-manual-ticket",
  "display_name": "Climate Manual Ticket",
  "domain": "climate",
  "version": "0.1.0",
  "lifecycle_stage": "shadow",
  "enabled": false,
  "managed_by_registry": false,
  "execution": {"mode": "manual_signal", "environment": "shadow"},
  "entrypoint": {"script": "climate_manual_ticket_v001.py", "module": "polymarket_bot.climate_manual_ticket"},
  "data_dir": "data/climate_manual_strategy_v001",
  "safety": {"real_money": false, "automatic_orders": false, "withdrawals": false},
  "tags": ["climate", "manual", "signal-only"],
  "notes": "Genera tickets informativos; la entrada permanece manual y fuera del programa."
}
